{
  "assessment_id": "HIT-FIXTURE-040-CANONICAL",
  "schema_version": "0.4.0",
  "specification_version": "0.4.0",
  "predecessor_schema_version": "0.1.0",
  "migration_status": "native_0.4.0",
  "institutional_unit": "Synthetic Benefits Review Office",
  "decision_process": "Synthetic eligibility review using an AI recommendation and named human authorization",
  "assessment_scope": "period_level",
  "period": {"start": "2026-01-01", "end": "2026-03-31"},
  "follow_up_period": null,
  "ai_system_role": "The synthetic system retrieves evidence and recommends an eligibility outcome without final authority.",
  "sampling": {
    "population_or_record_universe": "All twenty synthetic decisions generated for the conformance fixture.",
    "selection_rule": "Review the complete synthetic record universe without sampling.",
    "known_exclusions": ["No real persons, institutions, or production records are represented."],
    "selection_effects": ["The fixture demonstrates contract behavior rather than field prevalence."]
  },
  "aggregation": {
    "mode": "dominant_pattern",
    "predeclared": true,
    "rationale": "The assessment reports the dominant operational pattern across the complete synthetic record set.",
    "other_rule": null
  },
  "actors": [
    {
      "actor_id": "ACT-REVIEWER",
      "institutional_identity": "Synthetic Benefits Review Office",
      "role_type": "human",
      "role_name": "Eligibility reviewer",
      "authority_types": ["direct", "appellate"],
      "mechanisms_controlled": ["case approval", "case rejection", "escalation"],
      "decision_stages": ["review", "authorization", "appeal"],
      "relationship": "assessed_actor",
      "related_actor_ids": [],
      "evidence_claim_ids": ["EC-ACCESS", "EC-AUTHORITY", "EC-REASONING", "EC-PACKET"],
      "notes": "Synthetic actor used only for executable conformance testing."
    }
  ],
  "assessor": {
    "name": "Synthetic Fixture Author",
    "organization": null,
    "assessment_date": "2026-07-18",
    "conflict_disclosure": "Synthetic repository fixture; no external institution is assessed."
  },
  "evidence_claims": [
    {
      "claim_id": "EC-ACCESS",
      "artifact_id": "ART-ACCESS-LOG",
      "artifact_type": "synthetic_access_log",
      "source_id": "SYN-1",
      "locator": {"locator_type": "record_id", "value": "ACCESS-001", "reproducibility_note": null},
      "proposition": "The reviewer accessed underlying evidence before each sampled decision.",
      "relation": "supports",
      "dimensions": ["counsel"],
      "actor_ids": ["ACT-REVIEWER"],
      "event_date": "2026-02-01",
      "provenance_status": "verified",
      "independence_status": "independent",
      "transformation_history": ["Generated as a deterministic synthetic fixture."],
      "notes": null
    },
    {
      "claim_id": "EC-AUTHORITY",
      "artifact_id": "ART-AUTHORITY-MATRIX",
      "artifact_type": "synthetic_authority_matrix",
      "source_id": "SYN-2",
      "locator": {"locator_type": "section", "value": "reviewer-authority", "reproducibility_note": null},
      "proposition": "The reviewer could approve, reject, or escalate through an operationally tested mechanism.",
      "relation": "supports",
      "dimensions": ["command", "correction"],
      "actor_ids": ["ACT-REVIEWER"],
      "event_date": "2026-02-01",
      "provenance_status": "verified",
      "independence_status": "independent",
      "transformation_history": ["Generated as a deterministic synthetic fixture."],
      "notes": null
    },
    {
      "claim_id": "EC-REASONING",
      "artifact_id": "ART-REVIEW-NOTES",
      "artifact_type": "synthetic_review_notes",
      "source_id": "SYN-3",
      "locator": {"locator_type": "record_id", "value": "NOTE-001", "reproducibility_note": null},
      "proposition": "Reviewer-authored notes documented alternatives and reasons independent of the system recommendation.",
      "relation": "supports",
      "dimensions": ["judgment"],
      "actor_ids": ["ACT-REVIEWER"],
      "event_date": "2026-02-01",
      "provenance_status": "verified",
      "independence_status": "independent",
      "transformation_history": ["Generated as a deterministic synthetic fixture."],
      "notes": null
    },
    {
      "claim_id": "EC-PACKET",
      "artifact_id": "ART-PACKET-MANIFEST",
      "artifact_type": "synthetic_manifest",
      "source_id": "SYN-4",
      "locator": {"locator_type": "section", "value": "manifest", "reproducibility_note": null},
      "proposition": "The assessment packet has declared provenance and a complete synthetic file manifest.",
      "relation": "supports",
      "dimensions": ["telemetry_integrity"],
      "actor_ids": ["ACT-REVIEWER"],
      "event_date": null,
      "provenance_status": "verified",
      "independence_status": "independent",
      "transformation_history": ["Generated as a deterministic synthetic fixture."],
      "notes": null
    }
  ],
  "substantive_findings": [
    {
      "dimension": "counsel",
      "evidence_state": "observed_exercise",
      "finding": 2,
      "repair_trigger": "not_applicable",
      "supporting_claim_ids": ["EC-ACCESS"],
      "contradicting_claim_ids": [],
      "limiting_claim_ids": [],
      "requested_missing_artifacts": [],
      "unresolved_proposition": null,
      "search_or_request_summary": null,
      "aggregation_basis": "dominant_pattern",
      "rationale": "The complete synthetic access log records timely review of underlying evidence before each decision."
    },
    {
      "dimension": "judgment",
      "evidence_state": "observed_exercise",
      "finding": 2,
      "repair_trigger": "not_applicable",
      "supporting_claim_ids": ["EC-REASONING"],
      "contradicting_claim_ids": [],
      "limiting_claim_ids": [],
      "requested_missing_artifacts": [],
      "unresolved_proposition": null,
      "search_or_request_summary": null,
      "aggregation_basis": "dominant_pattern",
      "rationale": "Synthetic reviewer notes document alternatives and independent reasons capable of changing outcomes."
    },
    {
      "dimension": "command",
      "evidence_state": "operational_capability",
      "finding": 2,
      "repair_trigger": "not_applicable",
      "supporting_claim_ids": ["EC-AUTHORITY"],
      "contradicting_claim_ids": [],
      "limiting_claim_ids": [],
      "requested_missing_artifacts": [],
      "unresolved_proposition": null,
      "search_or_request_summary": null,
      "aggregation_basis": "tested_capability",
      "rationale": "The authority matrix and deterministic test establish usable approval, rejection, and escalation mechanisms."
    },
    {
      "dimension": "correction",
      "evidence_state": "formal_presence",
      "finding": 1,
      "repair_trigger": "not_applicable",
      "supporting_claim_ids": ["EC-AUTHORITY"],
      "contradicting_claim_ids": [],
      "limiting_claim_ids": [],
      "requested_missing_artifacts": ["Synthetic substantive appeal reconsideration record"],
      "unresolved_proposition": null,
      "search_or_request_summary": null,
      "aggregation_basis": "dominant_pattern",
      "rationale": "A formal appeal route exists, but the fixture does not contain substantive reconsideration or reversal evidence."
    },
    {
      "dimension": "repair",
      "evidence_state": "indeterminate",
      "finding": "IE",
      "repair_trigger": "indeterminate",
      "supporting_claim_ids": [],
      "contradicting_claim_ids": [],
      "limiting_claim_ids": [],
      "requested_missing_artifacts": ["Qualifying harm and remediation records"],
      "unresolved_proposition": "Whether a qualifying harm event occurred and activated a repair obligation.",
      "search_or_request_summary": "The synthetic fixture intentionally omits harm and remediation records.",
      "aggregation_basis": "dominant_pattern",
      "rationale": "The record cannot establish the Repair trigger, so the dimension remains insufficient evidence."
    },
    {
      "dimension": "reform",
      "evidence_state": "indeterminate",
      "finding": "IE",
      "repair_trigger": "not_applicable",
      "supporting_claim_ids": [],
      "contradicting_claim_ids": [],
      "limiting_claim_ids": [],
      "requested_missing_artifacts": ["Linked architecture-change and authorization records"],
      "unresolved_proposition": "Whether a named authority changed the decision architecture in response to a documented failure.",
      "search_or_request_summary": "The fixture contains no declared follow-up period or reform record.",
      "aggregation_basis": "dominant_pattern",
      "rationale": "Authority, linkage, timing, and implementation of architecture change cannot be determined."
    }
  ],
  "telemetry_integrity": {
    "institutional_record_integrity": {
      "status": "limited",
      "provenance": "Synthetic institutional records have deterministic repository provenance.",
      "scope_and_completeness": "The record set is complete for access, reasoning, and authority but omits repair and reform.",
      "edit_authority": "Repository maintainers control the synthetic records through version control.",
      "independence": "The records are synthetic and do not establish production-system independence.",
      "tamper_evidence": "Git history supplies change traceability but not external cryptographic attestation.",
      "retention": "Retention follows the public repository and tagged release history.",
      "contradictions": "No material internal contradiction appears in the synthetic record set.",
      "affected_dimensions": ["repair", "reform"],
      "evidence_claim_ids": ["EC-PACKET"],
      "unresolved_proposition": null,
      "rationale": "The records permit bounded fixture findings but do not represent a production institutional record system."
    },
    "assessment_packet_integrity": {
      "status": "adequate",
      "provenance": "The packet is generated and stored in the public repository.",